{
  "name": "schedule-extractor",
  "version": "2",
  "description": "Extract plant legends and material schedules from construction/landscape drawings — a PDF, or images (screenshots/photos) of schedule tables — into an Excel workbook (one sheet per detected schedule).",
  "when_to_use": "Use when the user attaches a construction, landscape, or site PDF, or one or more images of a drawing sheet or schedule table, and asks to pull plant legends, material schedules, planting tables, or similar tabular schedules out of them into a spreadsheet. Images are usually screenshots of just the schedule table; no title or header row is needed. Each image becomes one sheet. A photo of a whole sheet also works, but any other tables on it end up in the same sheet. Pass every schedule image in one call via input_files — they all land in one workbook, one sheet per schedule. Do NOT use for free-text questions, or for drawings with no schedule/legend tables.",
  "input_schema": {
    "type": "object",
    "properties": {
      "input_files": {
        "type": "array",
        "items": { "type": "string" },
        "minItems": 1,
        "maxItems": 10,
        "description": "Handles of the attached files to process, e.g. [\"file_1\", \"file_2\"]. Each must be one of the file handles listed in the conversation. One PDF, or one or more images; pass all the schedule images the user sent in a single call rather than calling once per image."
      },
      "input_file": {
        "type": "string",
        "description": "Single-file shorthand for input_files, e.g. \"file_1\". Use input_files when there is more than one."
      },
      "ignore_first_column": {
        "type": "boolean",
        "default": true,
        "description": "Drop the first table column (often a column of plant symbols/codes rather than data). Set false to keep it."
      },
      "split_names": {
        "type": "boolean",
        "default": true,
        "description": "Break a combined plant-name column (e.g. \"QUERCUS VIRGINIANA / LIVE OAK\") into separate \"Botanical Name\" and \"Common Name\" columns. Leave this true (the default) — set false ONLY when the user explicitly asks to keep botanical and common names together in one column."
      },
      "skip_pages": {
        "type": "array",
        "items": { "type": "integer" },
        "default": [],
        "description": "Zero-based page indices to skip in a PDF (e.g. cover sheets). Empty means scan every page. Ignored for images."
      }
    },
    "required": ["input_files"],
    "additionalProperties": false
  },
  "accepts": {
    "file_types": ["pdf", "png", "jpg", "jpeg", "webp", "bmp", "tif", "tiff", "gif"],
    "max_files": 10
  },
  "output": "An .xlsx workbook with one sheet per detected schedule — named \"Page N, Schedule M\" for a lone PDF, or after the source image/page when several files are processed — plus a short text summary of how many schedules were found.",
  "entrypoint": {
    "local": { "type": "subprocess", "cmd": ["run.py"], "cwd": "tools/schedule-extractor" },
    "lambda": { "type": "lambda", "function_name": "tm-tool-schedule-extractor" }
  },
  "timeout_seconds": 300
}
